[{"country":"United Arab Emirates","fatf":1,"basel":2,"sanctions":1,"safe_haven":1,"overall":1.35,"band":"Medium","firm_score":1.35},{"country":"Afghanistan","fatf":1,"basel":3,"sanctions":2,"safe_haven":3,"overall":2.1,"band":"High","firm_score":2.1},{"country":"Aland Islands","fatf":2,"basel":2,"sanctions":1,"safe_haven":1,"overall":1.65,"band":"Medium","firm_score":1.65},{"country":"Albania","fatf":1,"basel":2,"sanctions":2,"safe_haven":1,"overall":1.65,"band":"Medium","firm_score":1.65},{"country":"Algeria","fatf":2,"basel":2,"sanctions":1,"safe_haven":1,"overall":1.65,"band":"Medium","firm_score":3},{"country":"American Samoa","fatf":1,"basel":1,"sanctions":1,"safe_haven":1,"overall":1,"band":"Low","firm_score":1},{"country":"Andorra","fatf":1,"basel":1,"sanctions":1,"safe_haven":1,"overall":1,"band":"Low","firm_score":1},{"country":"Angola","fatf":2,"basel":2,"sanctions":1,"safe_haven":1,"overall":1.65,"band":"Medium","firm_score":3},{"country":"Anguilla","fatf":1,"basel":2,"sanctions":1,"safe_haven":1,"overall":1.35,"band":"Medium","firm_score":1.35},{"country":"Antarctica","fatf":1,"basel":1,"sanctions":1,"safe_haven":1,"overall":1,"band":"Low","firm_score":1},{"country":"Antigua and Barbuda","fatf":1,"basel":2,"sanctions":1,"safe_haven":1,"overall":1.35,"band":"Medium","firm_score":1.35},{"country":"Argentina","fatf":1,"basel":2,"sanctions":2,"safe_haven":1,"overall":1.65,"band":"Medium","firm_score":1.65},{"country":"Armenia","fatf":1,"basel":1,"sanctions":2,"safe_haven":1,"overall":1.3,"band":"Medium","firm_score":1.3},{"country":"Aruba","fatf":1,"basel":2,"sanctions":1,"safe_haven":1,"overall":1.35,"band":"Medium","firm_score":1.35},{"country":"Australia","fatf":1,"basel":2,"sanctions":1,"safe_haven":1,"overall":1.35,"band":"Medium","firm_score":1.35},{"country":"Austria","fatf":1,"basel":2,"sanctions":1,"safe_haven":1,"overall":1.35,"band":"Medium","firm_score":1.35},{"country":"Azerbaijan","fatf":1,"basel":2,"sanctions":2,"safe_haven":1,"overall":1.65,"band":"Medium","firm_score":1.65},{"country":"Bahamas","fatf":1,"basel":2,"sanctions":1,"safe_haven":1,"overall":1.35,"band":"Medium","firm_score":1.35},{"country":"Bahrain","fatf":1,"basel":2,"sanctions":1,"safe_haven":1,"overall":1.35,"band":"Medium","firm_score":1.35},{"country":"Bangladesh","fatf":1,"basel":2,"sanctions":1,"safe_haven":1,"overall":1.35,"band":"Medium","firm_score":1.35},{"country":"Barbados","fatf":1,"basel":2,"sanctions":1,"safe_haven":1,"overall":1.35,"band":"Medium","firm_score":1.35},{"country":"Belarus","fatf":1,"basel":2,"sanctions":3,"safe_haven":1,"overall":1.65,"band":"High","firm_score":3},{"country":"Belgium","fatf":1,"basel":2,"sanctions":1,"safe_haven":1,"overall":1.35,"band":"Medium","firm_score":1.35},{"country":"Belize","fatf":1,"basel":1,"sanctions":1,"safe_haven":1,"overall":1,"band":"Low","firm_score":1},{"country":"Benin","fatf":1,"basel":2,"sanctions":1,"safe_haven":1,"overall":1.35,"band":"Medium","firm_score":1.35},{"country":"Bermuda","fatf":1,"basel":2,"sanctions":1,"safe_haven":1,"overall":1.35,"band":"Medium","firm_score":1.35},{"country":"Bhutan","fatf":1,"basel":2,"sanctions":1,"safe_haven":1,"overall":1.35,"band":"Medium","firm_score":1.35},{"country":"Bolivia","fatf":2,"basel":2,"sanctions":1,"safe_haven":1,"overall":1.65,"band":"Medium","firm_score":3},{"country":"Bonaire","fatf":1,"basel":1,"sanctions":1,"safe_haven":1,"overall":1,"band":"Low","firm_score":1},{"country":"Bosnia-Herzegovina","fatf":1,"basel":2,"sanctions":2,"safe_haven":1,"overall":1.65,"band":"Medium","firm_score":1.65},{"country":"Botswana","fatf":1,"basel":2,"sanctions":1,"safe_haven":1,"overall":1.35,"band":"Medium","firm_score":1.35},{"country":"Bouvet Island","fatf":1,"basel":1,"sanctions":1,"safe_haven":1,"overall":1,"band":"Low","firm_score":1},{"country":"Brazil","fatf":1,"basel":2,"sanctions":1,"safe_haven":1,"overall":1.35,"band":"Medium","firm_score":1.35},{"country":"British Indian Ocean Territory","fatf":1,"basel":1,"sanctions":1,"safe_haven":1,"overall":1,"band":"Low","firm_score":1},{"country":"British Virgin Islands","fatf":2,"basel":3,"sanctions":1,"safe_haven":1,"overall":2,"band":"Medium","firm_score":3},{"country":"Brunei","fatf":1,"basel":2,"sanctions":1,"safe_haven":1,"overall":1.35,"band":"Medium","firm_score":1.35},{"country":"Bulgaria","fatf":2,"basel":2,"sanctions":2,"safe_haven":1,"overall":1.95,"band":"Medium","firm_score":3},{"country":"Burkina Faso","fatf":1,"basel":2,"sanctions":1,"safe_haven":3,"overall":1.45,"band":"Medium","firm_score":1.45},{"country":"Burundi","fatf":1,"basel":2,"sanctions":2,"safe_haven":1,"overall":1.65,"band":"Medium","firm_score":1.65},{"country":"Cambodia","fatf":1,"basel":2,"sanctions":1,"safe_haven":1,"overall":1.35,"band":"Medium","firm_score":1.35},{"country":"Cameroon","fatf":2,"basel":2,"sanctions":1,"safe_haven":3,"overall":1.75,"band":"Medium","firm_score":3},{"country":"Canada","fatf":1,"basel":2,"sanctions":1,"safe_haven":1,"overall":1.35,"band":"Medium","firm_score":1.35},{"country":"Cape Verde","fatf":1,"basel":2,"sanctions":1,"safe_haven":1,"overall":1.35,"band":"Medium","firm_score":1.35},{"country":"Cayman Islands","fatf":1,"basel":2,"sanctions":1,"safe_haven":1,"overall":1.35,"band":"Medium","firm_score":1.35},{"country":"Central African Republic","fatf":1,"basel":3,"sanctions":2,"safe_haven":1,"overall":2,"band":"Medium","firm_score":2},{"country":"Chad","fatf":1,"basel":3,"sanctions":1,"safe_haven":3,"overall":1.8,"band":"Medium","firm_score":1.8},{"country":"Chile","fatf":1,"basel":2,"sanctions":1,"safe_haven":1,"overall":1.35,"band":"Medium","firm_score":1.35},{"country":"China","fatf":1,"basel":3,"sanctions":2,"safe_haven":1,"overall":2,"band":"Medium","firm_score":2},{"country":"Christmas Island","fatf":1,"basel":1,"sanctions":1,"safe_haven":1,"overall":1,"band":"Low","firm_score":1},{"country":"Cocos (Keeling) Islands","fatf":1,"basel":1,"sanctions":1,"safe_haven":1,"overall":1,"band":"Low","firm_score":1},{"country":"Colombia","fatf":1,"basel":2,"sanctions":1,"safe_haven":3,"overall":1.45,"band":"Medium","firm_score":1.45},{"country":"Comoros","fatf":1,"basel":2,"sanctions":1,"safe_haven":1,"overall":1.35,"band":"Medium","firm_score":1.35},{"country":"Cook Islands","fatf":1,"basel":1,"sanctions":1,"safe_haven":1,"overall":1,"band":"Low","firm_score":1},{"country":"Costa Rica","fatf":1,"basel":2,"sanctions":1,"safe_haven":1,"overall":1.35,"band":"Medium","firm_score":1.35},{"country":"Cote Dâivoire","fatf":2,"basel":2,"sanctions":1,"safe_haven":1,"overall":1.65,"band":"Medium","firm_score":3},{"country":"Croatia","fatf":1,"basel":2,"sanctions":2,"safe_haven":1,"overall":1.65,"band":"Medium","firm_score":1.65},{"country":"Cuba","fatf":1,"basel":2,"sanctions":3,"safe_haven":1,"overall":1.95,"band":"High","firm_score":3},{"country":"Curacao","fatf":1,"basel":1,"sanctions":1,"safe_haven":1,"overall":1,"band":"Low","firm_score":1},{"country":"Cyprus","fatf":1,"basel":2,"sanctions":1,"safe_haven":1,"overall":1.35,"band":"Medium","firm_score":1.35},{"country":"Czech Republic","fatf":1,"basel":1,"sanctions":1,"safe_haven":1,"overall":1,"band":"Low","firm_score":1},{"country":"Democratic Republic of the Congo","fatf":2,"basel":3,"sanctions":2,"safe_haven":1,"overall":2.3,"band":"High","firm_score":3},{"country":"Denmark","fatf":1,"basel":1,"sanctions":1,"safe_haven":1,"overall":1,"band":"Low","firm_score":1},{"country":"Djibouti","fatf":1,"basel":2,"sanctions":1,"safe_haven":1,"overall":1.35,"band":"Medium","firm_score":1.35},{"country":"Dominica","fatf":1,"basel":2,"sanctions":1,"safe_haven":1,"overall":1.35,"band":"Medium","firm_score":1.35},{"country":"Dominican Republic","fatf":1,"basel":2,"sanctions":1,"safe_haven":1,"overall":1.35,"band":"Medium","firm_score":1.35},{"country":"Ecuador","fatf":1,"basel":2,"sanctions":1,"safe_haven":1,"overall":1.35,"band":"Medium","firm_score":1.35},{"country":"Egypt","fatf":1,"basel":2,"sanctions":2,"safe_haven":3,"overall":1.75,"band":"Medium","firm_score":1.75},{"country":"El Salvador","fatf":1,"basel":2,"sanctions":1,"safe_haven":1,"overall":1.35,"band":"Medium","firm_score":1.35},{"country":"Equatorial Guinea","fatf":1,"basel":3,"sanctions":1,"safe_haven":1,"overall":1.7,"band":"Medium","firm_score":1.7},{"country":"Eritrea","fatf":1,"basel":2,"sanctions":1,"safe_haven":1,"overall":1.35,"band":"Medium","firm_score":1.35},{"country":"Estonia","fatf":1,"basel":1,"sanctions":1,"safe_haven":1,"overall":1,"band":"Low","firm_score":1},{"country":"Ethiopia","fatf":1,"basel":2,"sanctions":1,"safe_haven":1,"overall":1.35,"band":"Medium","firm_score":1.35},{"country":"Falkland Islands","fatf":1,"basel":1,"sanctions":1,"safe_haven":1,"overall":1,"band":"Low","firm_score":1},{"country":"Faroe Islands","fatf":1,"basel":1,"sanctions":1,"safe_haven":1,"overall":1,"band":"Low","firm_score":1},{"country":"Fiji","fatf":1,"basel":2,"sanctions":1,"safe_haven":1,"overall":1.35,"band":"Medium","firm_score":1.35},{"country":"Finland","fatf":1,"basel":1,"sanctions":1,"safe_haven":1,"overall":1,"band":"Low","firm_score":1},{"country":"France","fatf":1,"basel":1,"sanctions":1,"safe_haven":1,"overall":1,"band":"Low","firm_score":1},{"country":"French Guiana","fatf":1,"basel":1,"sanctions":1,"safe_haven":1,"overall":1,"band":"Low","firm_score":1},{"country":"French Polynesia","fatf":1,"basel":1,"sanctions":1,"safe_haven":1,"overall":1,"band":"Low","firm_score":1},{"country":"French Southern Territories","fatf":1,"basel":1,"sanctions":1,"safe_haven":1,"overall":1,"band":"Low","firm_score":1},{"country":"Gabon","fatf":1,"basel":3,"sanctions":1,"safe_haven":1,"overall":1.7,"band":"Medium","firm_score":1.7},{"country":"Gambia","fatf":1,"basel":2,"sanctions":1,"safe_haven":3,"overall":1.45,"band":"Medium","firm_score":1.45},{"country":"Georgia","fatf":1,"basel":2,"sanctions":1,"safe_haven":1,"overall":1.35,"band":"Medium","firm_score":1.35},{"country":"Germany","fatf":1,"basel":2,"sanctions":1,"safe_haven":1,"overall":1.35,"band":"Medium","firm